{"$schema":"https://json-schema.org/draft/2020-12/schema","$id":"https://example.invalid/basic-structure/preset.schema.json","title":"Basic Structure project preset","type":"object","additionalProperties":false,"required":["schemaVersion","id","version","name","description","extends","profile","modules","adapters"],"properties":{"$schema":{"type":"string"},"schemaVersion":{"const":1},"id":{"type":"string","pattern":"^[a-z][a-z0-9-]*$"},"version":{"type":"string","pattern":"^(0|[1-9][0-9]*)\\.(0|[1-9][0-9]*)\\.(0|[1-9][0-9]*)$"},"name":{"type":"string","minLength":1},"description":{"type":"string","minLength":1},"extends":{"type":"array","uniqueItems":true,"items":{"type":"string","pattern":"^[a-z][a-z0-9-]*$"}},"profile":{"type":["object","null"]},"modules":{"type":"object"},"adapters":{"type":"object"}}}
