{"$schema":"../schemas/preset.schema.json","schemaVersion":1,"id":"security-hardened","version":"1.0.0","name":"Security hardened","description":"Production composition with repository and container security gates.","extends":["production"],"profile":null,"modules":{},"adapters":{"github-security":"^1.0.0"}}
